isco08,isco08_name,isco08_definition,AIOE_glo,share_glo,AIOE_hic,share_hic,AIOE_mic,share_mic,AIOE_lic,share_lic,icon
1,Commissioned Armed forces Officers,Commissioned armed forces officers provide leadership and management to organizational units in the armed forces and/or perform similar tasks to those performed in a variety of civilian occupations outside the armed forces. This group includes all members of the armed forces holding the rank of second lieutenant (or equivalent) or higher. Competent performance in most occupations in this sub-major group requires skills at the fourth ISCO skill level.,87.967789,0.016800053,,,87.967789,0.019496327,,,icon_1_svg
2,Non-commissioned Armed Forces Officers,"Non-commissioned armed forces officers enforce military discipline and supervise the activities of those employed in Sub-major Group 03: Armed Forces Occupations, Other Ranks, and/or perform similar tasks to those performed in a variety of civilian occupations outside the armed forces. This group includes members of the armed forces holding ranks such as sergeant, warrant officer and sergeant major. Competent performance in most occupations in this sub-major group requires skills at the second ISCO skill level.",91.279976,0.016216449,,,91.279976,0.01881906,,,icon_2_svg
3,"Armed Forces Occupations, Other Ranks","Armed forces occupations, other ranks include all conscripted and non-conscripted members of the armed forces except commissioned and non-commissioned officers. They perform specific military tasks and/or perform similar tasks to those performed in a variety of civilian occupations outside the armed forces. Most occupations in this sub-major group require skills at the first ISCO skill level.",62.310959,0.056014095,,,62.310959,0.065003909,,,icon_3_svg
10,Managers,"Managers plan, direct, coordinate and evaluate the overall activities of enterprises, governments and other organizations, or of organizational units within them, and formulate and review their policies, laws, rules and regulations. Competent performance in most occupations in this major group requires skills at the fourth ISCO skill level, except for Sub-major group 14: Hospitality, Retail and Other Services Managers, for which skills at the third ISCO skill level are generally required.",83.928246,0.0077827554,,,83.928246,0.0090318257,,,icon_10_svg
11,"Chief Executives, Senior Officials and Legislators","Chief executives, senior officials and legislators formulate and review the policies, and plan, direct, coordinate and evaluate the overall activities, of enterprises, governments and other organizations with the support of other managers. Competent performance in most occupations in this sub-major group requires skills at the fourth ISCO skill level.",86.360725,1.8181829,85.966995,6.2709212,86.56131,1.3924035,86.368622,0.17040247,icon_11_svg
12,Administrative and Commercial Managers,"Administrative and commercial managers plan, organize, direct, control and coordinate the financial, administrative, human resource, policy, planning, research and development, advertising, public relations, and sales and marketing activities of enterprises and organizations, or of enterprises that provide such services to other enterprises and organizations. Competent performance in most occupations in this sub-major group requires skills at the fourth ISCO skill level.",87.332863,1.018042,98.383026,1.3531891,85.644005,1.0220264,92.767296,0.13302107,icon_12_svg
13,Production and Specialized Services Managers,"Production and specialized services managers plan direct and coordinate the production of the goods and the provision of the specialized professional and technical services provided by an enterprise or organization either as the manager of a department or as the general manager of an enterprise or organization that does not have a hierarchy of managers. They are responsible for manufacturing, mining, construction, logistics, information and communications technology operations, for large scale agricultural, forestry and fisheries operations, and for the provision of health, education, social welfare, banking, insurance and other professional and technical services. Competent performance in most occupations in this sub-major group requires skills at the fourth ISCO skill level.",83.214928,1.4322188,80.6996,4.1486416,84.250656,1.1865181,75.394554,0.13026473,icon_13_svg
14,"Hospitality, Retail and Other Services Managers","Hospitality, shop and related services managers plan, organize and direct the operations of establishments which provide accommodation, hospitality, retail and other services. Competent performance in most occupations in this sub-major group requires skills at the third ISCO skill level.",71.39183,0.618801,57.7509,1.333199,75.007721,0.56331229,76.637321,0.083599135,icon_14_svg
20,Professionals,Professionals increase the existing stock of knowledge; apply scientific or artistic concepts and theories; teach about the foregoing in a systematic manner; or engage in any combination of these activities. Competent performance in most occupations in this major group requires skills at the fourth ISCO skill level.,85.399971,0.060021736,,,85.399971,0.06965474,,,icon_20_svg
21,Science and Engineering Professionals,"Science and engineering professionals conduct research, improve or develop concepts, theories and operational methods, or apply scientific knowledge relating to fields such as physics, astronomy, meteorology, chemistry, geophysics, geology, biology, ecology, pharmacology, medicine, mathematics, statistics, architecture, engineering, design and technology. Competent performance in most occupations in this sub-major group requires skills at the fourth ISCO skill level.",85.556892,0.92198092,81.409073,3.1709154,87.641586,0.69767034,88.049545,0.28537747,icon_21_svg
22,Health Professionals,"Health professionals conduct research; improve or develop concepts, theories and operational methods; and apply scientific  knowledge relating to medicine, nursing, dentistry, veterinary medicine, pharmacy, and  promotion of health. Competent performance in most occupations in this sub-major group requires skills at the fourth ISCO skill level.",70.438454,1.2211845,69.075783,5.5557399,71.553291,0.77258295,70.143074,0.33781722,icon_22_svg
23,Teaching Professionals,"Teaching professionals teach the theory and practice of one or more  disciplines at different educational levels; conduct research; improve or develop concepts, theories and operational methods pertaining to their  particular discipline; and prepare scholarly papers and books. Competent performance in most occupations in this sub-major group requires skills at the fourth ISCO skill level.",85.2155,3.1486251,83.90081,6.3109055,85.481255,2.8429534,87.104919,2.0478406,icon_23_svg
24,Business and Administration Professionals,"Business and administration professionals perform analytical, conceptual and practical tasks to provide services in financial matters, human resource development, public relations, marketing and sales in the technical, medical, information and communication technology areas; and conduct, reviews of organizational structures, methods and systems as well as quantitative analyses of information affecting investment programmes. Competent performance in most occupations in this sub-major group requires skills at the fourth ISCO skill level.",96.167809,1.2311072,95.602043,4.1201873,96.419014,0.92868698,97.068161,0.71449274,icon_24_svg
25,Information and Communications Technology Professionals,"Information and communications technology professionals conduct research, plan, design, write, test, provide advice and improve information technology systems, hardware, software and related concepts for specific applications; develop associated documentation including principles, policies and procedures; and design, develop, control, maintain and support databases and other information systems to ensure optimal performance and data integrity and security.",92.628441,0.7539553,92.784569,3.1335764,92.540047,0.51782238,88.933128,0.054752391,icon_25_svg
26,"Legal, Social and Cultural Professionals","Legal, social and cultural professionals conduct research, improve or develop concepts, theories and operational methods; or apply knowledge relating to the law,  storage and retrieval of information and artefacts, psychology, social welfare, politics, economics, history, religion, languages, sociology, other social sciences, and arts and entertainment. Competent performance in most occupations in this sub-major group requires skills at the fourth ISCO skill level.",88.558891,1.0214818,88.26757,3.5362995,88.646591,0.77654016,94.083412,0.18525274,icon_26_svg
30,Technicians and Associate Professionals,"Technicians and associate professionals perform technical and related tasks connected with research and the application of scientific or artistic concepts and operational methods, and government or business regulations. Competent performance in most occupations in this major group requires skills at the third ISCO skill level.",66.413177,0.018957112,,,66.413177,0.021999575,,,icon_30_svg
31,Science and Engineering Associate Professionals,"Science and engineering associate professionals perform technical tasks connected with research and operational methods in science and engineering. They supervise and control technical and operational aspects of mining, manufacturing, construction and other engineering operations, and operate technical equipment including aircraft and ships. Competent performance in most occupations in this sub-major group requires skills at the third ISCO skill level.",57.757488,1.0234184,56.294083,2.2402341,58.139477,0.92573756,59.802692,0.17873943,icon_31_svg
32,Health Associate Professionals,"Health associate professionals perform technical and practical tasks to support diagnosis and treatment of illness, disease, injuries and impairments in humans and animals, and to support implementation of health care, treatment and referral plans usually established by medical, veterinary, nursing and other health professionals. Competent performance in most occupations in this sub-major group requires skills at the third ISCO skill level.",54.820713,0.9147433,53.535866,2.435905,55.25547,0.771312,56.104015,0.30905169,icon_32_svg
33,Business and Administration Associate Professionals,"Business and administration associate professionals perform mostly technical tasks connected with the practical application of knowledge relating to financial accounting and transaction matters, mathematical calculations, human resource development, selling and buying financial instruments, specialized secretarial tasks, and enforcing or applying government rules. Also included are workers who provide business services such as customs clearance, conference planning, job placements, buying and selling real estate or bulk commodities, and serving as agents for performers such as athletes and artists. Competent performance in most occupations in this sub-major group requires skills at the third ISCO skill level.",86.599113,2.0254705,85.203491,6.9102316,87.29657,1.5509903,87.131454,0.37389007,icon_33_svg
34,"Legal, Social, Cultural and Related Associate Professionals","Legal, social, cultural and related associate professionals perform technical tasks connected with the practical application of knowledge relating to legal services, social work, culture, food preparation, sport and religion. Competent performance in most occupations in this sub-major group requires skills at the third ISCO skill level.",61.96727,0.68497431,52.552494,2.1754835,66.151321,0.53829414,68.186928,0.22114576,icon_34_svg
35,Information and Communications Technicians,"Information and communications technicians provide support for the day-to-day running of computer systems, communications systems and networks and perform technical tasks related to telecommunications, broadcast of image and sound as well as other types of telecommunications signals on land, sea or in aircraft. Competent performance in most occupations in this sub-major group requires skills at the third ISCO skill level.",75.069672,0.24665073,73.139221,0.67922103,75.774292,0.20593448,76.010605,0.07290975,icon_35_svg
40,Clerical Support Workers,"Clerical support workers record, organise, store, compute and retrieve information, and perform a number of clerical duties in connection with money-handling operations, travel arrangements, requests for information, and appointments. Competent performance in most occupations in this major group requires skills at the second ISCO skill level.",76.023285,0.030291382,,,76.023285,0.035152905,,,icon_40_svg
41,General and Keyboard Clerks,"General and keyboard clerks record, organize, store and retrieve information and perform a wide range of clerical and administrative tasks according to established procedures. Competent performance in most occupations in this sub-major group requires skills at the second ISCO skill level.",87.504768,1.4355651,73.879845,0.65906185,88.152786,1.582846,86.366936,0.18051377,icon_41_svg
42,Customer Services Clerks,"Customer services clerks deal with clients in connection with money-handling operations, travel arrangements, requests for information, making appointments, operating telephone switchboards, and interviewing for surveys or to complete applications for eligibility for services. Competent performance in most occupations in this sub-major group requires skills at the second ISCO skill level.",83.517891,1.1480365,84.902161,4.3451009,82.746407,0.83214045,78.995361,0.18007261,icon_42_svg
43,Numerical and Material Recording Clerks,"Numerical and material recording clerks obtain, compile and compute accounting, bookkeeping, statistical, financial, and other numerical data, and take charge of cash transactions incidental to business matters. Some occupations classified here keep records of goods produced, purchased, stocked, dispatched, and of materials needed at specified production dates, or keep records of operational aspects and coordinate the timing of passenger and freight transport. Competent performance in most occupations in this sub-major group requires skills at the second ISCO skill level.",70.989059,0.75634319,58.456806,2.1983674,75.942352,0.62678337,76.640572,0.046791915,icon_43_svg
44,Other Clerical Support Workers,"Other clerical support workers sort and deliver mail, file documents, prepare information for processing, maintain personnel records, check material for consistency with original source material, assist persons who cannot read or write, and perform various other specialized clerical duties. Competent performance in most occupations in this sub-major group requires skills at the second ISCO skill level.",67.040436,0.32789135,56.462189,0.44538045,68.63562,0.32501963,69.899811,0.10778996,icon_44_svg
50,Service and Sales Workers,"Service and sales workers provide personal and protective services related to travel, housekeeping, catering, personal care, or protection against fire and unlawful acts, or demonstrate and sell goods in wholesale or retail shops and similar establishments, as well as at stalls and on markets. Competent performance in most occupations in this major group requires skills at the second ISCO skill level.",55.733177,0.1177706,,,55.733177,0.13667184,,,icon_50_svg
51,Personal Service Workers,"Personal service workers provide personal services related to travel, housekeeping, catering and hospitality, hairdressing and beauty treatment, animal care grooming and training, companionship and other services of a personal nature. Competent performance in most occupations in this sub-major group requires skills at the second ISCO skill level.",43.874542,3.3419116,36.08979,5.8272719,45.40527,3.0754592,46.836197,3.0303807,icon_51_svg
52,Sales Workers,"Sales workers sell and demonstrate goods in wholesale or retail shops, at stalls and markets, door-to-door, via telephone or customer contact centres. They may record and accept payment for goods and services purchased, and may operate small retail outlets. Competent performance in most occupations in this sub-major group requires skills at the second ISCO skill level.",65.346764,9.7889957,58.426548,6.825099,65.649422,10.186377,70.978638,8.4788094,icon_52_svg
53,Personal Care Workers,"Personal care workers provide care, supervision and assistance for children, patients and elderly, convalescent or disabled persons in institutional and residential settings. Competent performance in most occupations in this sub-major group requires skills at the second ISCO skill level.",53.830746,0.71283543,52.36414,2.482995,54.572186,0.54311389,56.756607,0.067389339,icon_53_svg
54,Protective Services Workers,"Protective services workers protect individuals and property against fire and other hazards, maintain law and order and enforce laws and regulations. Competent performance in most occupations in this sub-major group requires skills at the second ISCO skill level.",44.867668,1.211278,81.872337,0.33979154,43.750885,1.336673,47.162113,0.64543235,icon_54_svg
60,"Skilled Agricultural, Forestry and Fishery Workers","Skilled agricultural, forestry and fishery workers grow and harvest field or tree  and shrub crops, gather wild fruits and plants, breed, tend or hunt animals, produce a variety of animal husbandry products; cultivate, conserve and exploit forests; breed or catch fish; and cultivate or gather other forms of aquatic life in order to provide food, shelter and income for themselves and  their households. Competent performance in most occupations in this major group requires skills at the second ISCO skill level.",32.12455,0.061245311,,,32.12455,0.071074694,,,icon_60_svg
61,Market-oriented Skilled Agricultural Workers,"Market-oriented skilled agricultural workers plan, organize and perform farming operations to grow and harvest field or tree and shrub crops and produce a variety of animals and animal products for sale or delivery on a regular basis to wholesale buyers, marketing organisations or at markets. Competent performance in most occupations in this sub-major group requires skills at the second ISCO skill level.",35.425571,20.859118,28.226889,1.3349812,35.471874,23.499907,35.424126,11.740405,icon_61_svg
62,"Market-Oriented Skilled Forestry, Fishery and Hunting Workers","Market-oriented skilled forestry, fishery and hunting workers plan, organize and perform operations to cultivate, conserve and exploit natural and plantation forests, breed and raise fish, harvest and catch fish; and hunt and trap animals, for sale or delivery on a regular basis to wholesale buyers, marketing organizations or at markets. Competent performance in most occupations in this sub-major group requires skills at the second ISCO skill level.",23.35117,3.0413985,22.753733,0.073389232,23.290499,3.4993513,33.288712,0.4617624,icon_62_svg
63,"Subsistence Farmers, Fishers, Hunters and Gatherers","Subsistence farmers, fishers, hunters and gatherers grow and harvest field or tree and shrub crops, vegetables and fruit, gather wild fruits, medicinal and other plants, tend or hunt animals, catch fish and gather various forms of aquatic life in order to provide food, shelter and, in some cases, a minimum of cash income for themselves and their households. Competent performance in most occupations in this sub-major group requires skills at the second ISCO skill level.",20.394651,2.7207007,,,17.982489,1.4588577,22.46649,35.872288,icon_63_svg
70,Craft and Related Trades Workers,"Craft and related trades workers apply specific technical and practical knowledge and skills in the fields to construct and maintain buildings; form metal; erect metal structures; set machine tools or make, fit, maintain and repair machinery, equipment or tools; carry out printing work; and produce or process foodstuffs, textiles and wooden, metal and other articles, including handicraft goods. Competent performance in most occupations in this major group requires skills at the second ISCO skill level.
The work is carried out by hand and by hand-powered and other tools which are used to reduce the amount of physical effort and time required for specific tasks, as well as to improve the quality of the products. The tasks call for an understanding of all stages of the production process, the materials and tools used, and the nature and purpose of the final product.",34.817726,0.041468836,,,34.817726,0.04812425,,,icon_70_svg
71,Building and Related Trades Workers (excluding Electricians),"Building and related trades workers construct, maintain and repair buildings, erect and repair foundations, walls and structures of brick, stone and similar materials; shape and finish stone for building and other purposes. Competent performance in most occupations in this sub-major group requires skills at the second ISCO skill level.
The work is carried out by hand and by hand-powered and other tools which are used to reduce the amount of physical effort and time required for specific tasks, as well as to improve the quality of the products. The tasks call for an understanding of the work organization, the materials and tools used, and the nature and purpose of the final product. ",25.037928,3.7184956,22.434101,3.6820772,25.15041,3.864167,43.874592,0.72893029,icon_71_svg
72,"Metal, Machinery and Related Trades Workers","Metal, machinery and related trades workers cast, weld, forge and, by other methods, form metal; erect, maintain and repair heavy metal structures; engage in machine-tool setting as well as in fitting, maintaining and repairing machinery, including engines, vehicles, or they produce tools and various non-precious-metal articles. Competent performance in most occupations in this sub-major group requires skills at the second ISCO skill level.
The work is carried out by hand and by hand-powered and other tools which are used to reduce the amount of physical effort and time required for specific tasks, as well as to improve the quality of the products. The tasks call for an understanding of the work organisation, the materials and tools used, and the nature and purpose of the final product.",33.937138,1.8445247,31.046225,1.080238,34.120956,2.0061722,32.667789,0.25685966,icon_72_svg
73,Handicraft and Printing Workers,"Handicraft and printing workers combine artistic and manual skills to design, produce, maintain and decorate precision instruments, musical instruments, jewellery and other precious-metals, pottery, porcelain and glassware, items made of wood or textile, leather or related materials, and printed products such as books, newspapers and magazines. They apply traditional and/or recently developed techniques to carve, mould, assemble, weave and decorate various articles; to compose and set type prior to printing; to set up and operate printing presses; to bind and finish printed products; and to prepare stencils and operate screen printing equipment. Competent performance in most occupations in this sub-major group requires skills at the second ISCO skill level.

The work may be carried out by hand or involve the use of hand tools, hand-held power tools and in some cases the set-up and operation of machinery and machine tools. The tasks call for an understanding of the work organisation, the materials and tools used, and the nature and purpose of the final product.",40.188782,0.98653281,42.413292,0.21474382,40.134163,1.083205,40.325745,0.7890774,icon_73_svg
74,Electrical and Electronics Trades Workers,"Electrical and electronics trades workers install, fit and maintain electrical wiring systems and machinery and other electrical apparatus, electrical transmission and supply lines and cables, and electronic and telecommunications equipment and systems. Competent performance in most occupations in this sub-major group requires skills at the second ISCO skill level.

The work is carried out by hand and by hand-powered and other tools which are used to reduce the amount of physical effort and time required for specific tasks, as well as to improve the quality of the products. The tasks call for an understanding of the work organisation, the materials and tools used, and the nature and purpose of the final product.",39.647835,1.0068667,35.954803,0.92041558,40.005657,1.0594399,40.773693,0.10310207,icon_74_svg
75,"Food Processing, Woodworking, Garment and Other Craft and Related Trades Workers","Food processing, woodworking, garment and other craft and related trades workers treat and process agricultural and fisheries raw materials into food and other products, and produce and repair goods made of wood, textiles, fur, leather or other materials. Competent performance in most occupations in this sub-major group requires skills at the second ISCO skill level.

The work is carried out by hand and by hand-powered and other tools which are used to reduce the amount of physical effort and time required for specific tasks, as well as to improve the quality of the products.  The tasks call for an understanding of the work organization, the materials and tools used, and the nature and purpose of the final product.",37.54324,3.4239595,45.837723,1.5303587,37.12999,3.742238,39.441643,1.2268436,icon_75_svg
