isco08,isco08_name,isco08_definition,AIOE_glo,share_glo,AIOE_hic,share_hic,AIOE_mic,share_mic,AIOE_lic,share_lic,icon
80,"Plant and Machine Operators, and Assemblers","Plant and machine operators, and assemblers operate and monitor industrial and agricultural machinery and equipment on the spot or by remote control; drive and operate trains, motor vehicles and mobile machinery and equipment; or assemble products from component parts according to strict specifications and procedures. Competent performance in most occupations in this major group requires skills at the second ISCO skill level.

The work mainly calls for experience with and an understanding of industrial and agricultural machinery and equipment as well as an ability to cope with machine-paced operations and to adapt to technological innovations.",31.915344,0.077865653,,,31.915344,0.090362467,,,icon_80_svg
81,Stationary Plant and Machine Operators,"Stationary plant and machine operators monitor and operate stationary industrial plant, machinery and equipment, or for which mobility is not an integral part of operation. Competent performance in most occupations in this sub-major group requires skills at the second ISCO skill level.

The work mainly calls for experience with and an understanding of the industrial plant, machinery or equipment being operated and monitored. Ability to cope with machine-paced operations and to adapt to innovations in machinery and  equipment is often required.",32.248119,1.6318759,34.506386,1.7434138,31.987118,1.6801986,31.824215,0.34476453,icon_81_svg
82,Assemblers,"Assemblers assemble prefabricated parts or components to form subassemblies, products and equipment, according to procedures strictly laid down. The products worked on may be moved from one worker to the next along assembly lines. Competent performance in most occupations in this sub-major group requires skills at the second ISCO skill level.",37.167519,0.39204457,38.652641,0.21014361,36.997269,0.4176406,39.809467,0.2861256,icon_82_svg
83,Drivers and Mobile Plant Operators,"Drivers and mobile plant operators drive and tend trains and motor vehicles, or drive, operate and monitor industrial and agricultural machinery and equipment, or execute deck duties on board ship and other water-borne craft. Competent performance in most occupations in this sub-major group requires skills at the second ISCO skill level.",43.740513,4.0838857,42.243458,0.71675122,43.748741,4.6092658,45.445541,1.0339338,icon_83_svg
90,Elementary Occupations,Elementary occupations involve the performance of simple and routine tasks which may require the use of hand-held tools and considerable physical effort. Most occupations in this major group require skills at the first ISCO skill level.,28.723318,0.18474078,,,28.723318,0.2143902,,,icon_90_svg
91,Cleaners and Helpers,"Cleaners and helpers perform various tasks in private households, hotels, offices, hospitals and other establishments, as well as in aircraft, trains coaches, trams and similar vehicles, in order to keep the interiors and fixtures clean, and launder and press garments and textiles by hand. Most occupations in this sub-major group require skills at the first ISCO skill level.",21.48822,2.8195233,22.424795,2.5643663,21.467333,2.9275022,17.616249,1.148721,icon_91_svg
92,"Agricultural, Forestry and Fishery Labourers","Agricultural, forestry and fishery labourers perform simple and routine tasks in the production of crops and livestock, cultivation and maintenance of gardens and parks, exploitation and conservation of forests, and conduct of aquaculture and fisheries operations. Most occupations in this sub-major group require skills at the first ISCO skill level.",27.544674,5.923902,25.757998,1.5805354,27.644186,6.0226755,27.128981,14.216709,icon_92_svg
93,"Labourers in Mining, Construction, Manufacturing and Transport","Labourers in mining, construction, manufacturing and transport perform simple and routine manual tasks in mining, quarrying, civil engineering, building, manufacturing, transport and storage operations, and operate human-powered and animal-drawn vehicles and machinery. Most occupations in this sub-major group require skills at the first ISCO skill level.",21.885023,7.499794,15.067061,4.8851323,22.351404,8.0267801,22.085943,2.6178012,icon_93_svg
94,Food Preparation Assistants,"Food preparation assistants prepare and cook to order a small variety of pre-cooked food or beverages, clear tables, clean kitchen areas and wash dishes. Most occupations in this sub-major group require skills at the first ISCO skill level.",33.670918,0.81632191,33.044193,2.7774858,34.472206,0.57655668,28.981947,1.1937773,icon_94_svg
95,Street and Related Sales and Service Workers,"Street and related sales and service workers sell goods (excluding food) for immediate consumptions, and provide a variety of services on streets and in other public places such as stations. Most occupations in this sub-major group require skills at the first ISCO skill level.",59.412006,0.77377754,,,55.512966,0.7978853,90.497856,2.1136384,icon_95_svg
96,Refuse Workers and Other Elementary Workers,"Refuse workers and other elementary workers collect, process and recycle garbage from buildings, yards, streets and other public places. They keep streets and other public places clean and tidy, deliver and carry messages and packages and perform odd jobs for private households or establishments. Most occupations in this sub-major group require skills at the first ISCO skill level.",32.740528,0.9644109,40.7813,0.18824814,33.345753,0.7271772,31.091373,7.8295193,icon_96_svg